word,part_of_speech,english_word,sense
styrefjær,noun,flight,feather on an arrow
fjær,noun,flight,feather on an arrow
papirfly,noun,flight,paper plane
bane,noun,flight,ballistic trajectory
gulv,noun,floor,bottom part of a room
golv,noun,floor,bottom part of a room
blomst,noun,flower,reproductive structure in angiosperms
fly,verb,fly,to travel through air
flyge,verb,fly,to travel through air
fly,verb,fly,to flee
mat,noun,food,any substance consumed by living organisms to sustain life
føde,noun,food,any substance consumed by living organisms to sustain life
næring,noun,food,any substance consumed by living organisms to sustain life
fot,noun,foot,part of human body
pote,noun,foot,part of animal’s body
labb,noun,foot,part of animal’s body
fot,noun,foot,unit of measure
fotball,noun,football,association football
fotball,noun,football,ball
fotball,noun,football,practise of any of these games
glemme,verb,forget,to lose remembrance of
glømme,verb,forget,to lose remembrance of
glemme,verb,forget,to cease remembering
glømme,verb,forget,to cease remembering
venn,noun,friend,person whose company one enjoys
venninne,noun,friend,person whose company one enjoys
vennlig,adj,friendly,"approachable, warm"
vennlig,adj,friendly,characteristic of friendliness
frukt,noun,fruit,part of plant
frukt,noun,fruit,food
frukt,noun,fruit,figuratively: positive end result or reward of labour or effort
full,adj,full,containing the maximum possible amount
framtid,noun,future,the time ahead
framtid,noun,future,something that will happen in moments yet to come
spill,noun,game,"playful activity that may be unstructured, amusement, pastime"
lek,noun,game,"playful activity that may be unstructured, amusement, pastime"
vilt,noun,game,wild animals hunted for food
hage,noun,garden,piece of land outside with flowers and plants
have,noun,garden,piece of land outside with flowers and plants
park,noun,garden,gardens with public access
hageanlegg,noun,garden,gardens with public access
hage,noun,garden,grounds at the front or back of a house
tomt,noun,garden,grounds at the front or back of a house
geografi,noun,geography,study of physical structure and inhabitants of the Earth
jente,noun,girl,young female person
pike,noun,girl,young female person
dame,noun,girl,woman — see also woman
jente,noun,girl,woman — see also woman
kjæreste,noun,girlfriend,a female partner in a romantic relationship
venninne,noun,girlfriend,a female friend
gi,verb,give,transfer the possession of something to someone else
overrekke,verb,give,transfer the possession of something to someone else
overlate,verb,give,transfer the possession of something to someone else
skjenke,verb,give,transfer the possession of something to someone else
gi etter,verb,give,bend slightly when a force is applied
glass,noun,glass,substance
glass,noun,glass,drinking vessel
reise,verb,go,to move through space (especially from one place to another)
fare,verb,go,to move through space (especially from one place to another)
dra,verb,go,to move through space (especially from one place to another)
gå,verb,go,"of a machine, to work"
virke,verb,go,"of a machine, to work"
være i gang,verb,go,"of a machine, to work"
bli,verb,go,to become
forsvinne,verb,go,to disappear
gå over,verb,go,to disappear
ødelegges,verb,go,to be destroyed
si,verb,go,to make (a specified sound)
passe,verb,go,to fit
ligge,verb,go,to belong; to have as its/their proper place
høre til,verb,go,to belong; to have as its/their proper place
gå ut med,verb,go,to date
date,verb,go,to date
være sammen med,verb,go,to date
god,adj,good,acting in the interest of good; ethical good intentions
god,adj,good,useful for a particular purpose
god,adj,good,"of food, edible; not stale or rotten"
god,adj,good,"of food, having a particularly pleasant taste"
sunn,adj,good,healthful
god,adj,good,pleasant; enjoyable
god,adj,good,"of people, competent or talented"
flink,adj,good,"of people, competent or talented"
dyktig,adj,good,"of people, competent or talented"
bestefar,noun,grandfather,grandfather (from either side)
morfar,noun,grandfather,grandfather (from either side)
farfar,noun,grandfather,grandfather (from either side)
besteforelder,noun,grandparent,parent of one's parent
kjempebra,adj,great,very good
gruppe,noun,group,number of things or persons being in some relation to each other
gitar,noun,guitar,musical instrument
treningssenter,noun,gym,sporting facility specialized for lifting weights and exercise
gym,noun,gym,physical education class
kroppsøving,noun,gym,physical education class
hårstrå,noun,hair,pigmented filament of keratin on the skin of humans and other mammals
hår,noun,hair,mass of such filaments on the human head
hår,noun,hair,mass of such filaments growing from the skin of humans and animals
halvdel,noun,half,one of two equal parts into which anything may be divided
halvpart,noun,half,one of two equal parts into which anything may be divided
omgang,noun,half,one of two equal parts into which anything may be divided
banehalvdel,noun,half,one of two equal parts into which anything may be divided
halv,noun,half,half a standard measure
halv,noun,half,math: fraction
del,noun,half,part; side; behalf
hand,noun,hand,part of the fore limb
hånd,noun,hand,part of the fore limb
viser,noun,hand,"index or pointer on a dial, such as on an analogue/analog clock"
handskrift,noun,hand,handwriting; style of penmanship
håndskrift,noun,hand,handwriting; style of penmanship
foregå,verb,happen,to occur
fornøyd,adj,happy,content (to do something); having no objection (to something)
tilfreds,adj,happy,content (to do something); having no objection (to something)
hatt,noun,hat,a head covering
lue,noun,hat,a head covering
ha,verb,have,"to hold, as something at someone's disposal"
ha,verb,have,auxiliary used in forming the perfect and the past perfect tenses
hode,noun,head,part of the body
hode,noun,head,mental aptitude or skill
evne,noun,head,mental aptitude or skill
topp,noun,head,topmost or leading part
hode,noun,head,"end of hammer, axe, golf club etc."
hode,noun,head,"blunt end of a nail, screw etc."
skum,noun,head,foam on carbonated beverages
leder,noun,head,"leader, chief, mastermind"
sjef,noun,head,"leader, chief, mastermind"
rektor,noun,head,"headmaster, headmistress"
kjerne,noun,head,linguistics: morpheme that determines the category of a compound
helse,noun,health,"state of being free of physical or psychological disease, illness, or malfunction"
helse,noun,health,physical condition
frisk,adj,healthy,enjoying good health
karsk,adj,healthy,enjoying good health
sunn,adj,healthy,enjoying good health
sunn,adj,healthy,conducive to health
frisk,adj,healthy,evincing health
sunn,adj,healthy,"significant, hefty"
høre,verb,hear,to perceive with the ear
hjelp,noun,help,action given to provide assistance
hjelp,noun,help,person or persons who provides assistance with some task
hjelper,noun,help,person or persons who provides assistance with some task
hushjelp,noun,help,person employed to help in the maintenance of a house
historie,noun,history,aggregate of past events
historie,noun,history,branch of knowledge that studies the past
historikk,noun,history,set of events involving an entity
historie,noun,history,record or narrative description of past events
historikk,noun,history,record or narrative description of past events
historikk,noun,history,computing: record of previous user events
hobby,noun,hobby,activity done for enjoyment in spare time
hjemme,adv,home,at home
heime,adv,home,at home
hjem,adv,home,homewards
heim,adv,home,homewards
hjemover,adv,home,homewards
heimover,adv,home,homewards
lekse,noun,homework,work that is done at home
hjemmelekse,noun,homework,work that is done at home
håpe,verb,hope,"to want something to happen, with expectation that it might"
hest,noun,horse,members of the species Equus ferus
kavallerist,noun,horse,cavalry soldiers
hest,noun,horse,gymnastic equipment
bukk,noun,horse,gymnastic equipment
springer,noun,horse,knight in chess — see also knight
hest,noun,horse,knight in chess — see also knight
sykehus,noun,hospital,large medical facility
sjukehus,noun,hospital,large medical facility
het,adj,hot,having a high temperature
varm,adj,hot,having a high temperature
het,adj,hot,of the weather
varm,adj,hot,of the weather
varm,adj,hot,feeling the sensation of heat
varm,adj,hot,feverish
het,adj,hot,feverish
sterk,adj,hot,spicy
het,adj,hot,slang: physically very attractive
heit,adj,hot,slang: physically very attractive
lekker,adj,hot,slang: physically very attractive
sexy,adj,hot,slang: physically very attractive
hotell,noun,hotel,establishment providing accommodation
time,noun,hour,time period of sixty minutes
hus,noun,house,human abode
hus,noun,house,archetypal structure of a human abode
hus,noun,house,debating chamber for government politicians
hus,noun,house,"the inner workings, as of a clock"
hus,noun,house,"dynasty, familiar descendance"
hvor,adv,how,to what degree
hvordan,adv,how,in what manner
hvorledes,adv,how,in what manner
åssen,adv,how,in what manner
så,adv,how,"used as a modifier to indicate surprise, delight, or other strong feelings"
ikke desto mindre,adv,however,nevertheless
imidlertid,adv,however,nevertheless
men,adv,however,nevertheless
uansett hvor,adv,however,to whatever extent or degree
uten omsyn til hvor,adv,however,to whatever extent or degree
sulten,adj,hungry,affected by hunger; desirous of food
hungrig,adj,hungry,affected by hunger; desirous of food
hungrig,adj,hungry,"eager, having a desire for something"
ektemann,noun,husband,male partner in marriage
mann,noun,husband,male partner in marriage
husbond,noun,husband,male partner in marriage
is,noun,ice,water in frozen form
is,noun,ice,frozen volatile chemical
is,noun,ice,frozen dessert
iskrem,noun,ice,frozen dessert
is,noun,ice,ice hockey: area where game is played
iskrem,noun,ice cream,dessert
is,noun,ice cream,dessert
idé,noun,idea,"philosophy: abstract archetype of a given thing, compared to which real-life examples are seen as imperfect"
konsept,noun,idea,"philosophy: abstract archetype of a given thing, compared to which real-life examples are seen as imperfect"
begrep,noun,idea,an image of an object that is formed in the mind or recalled by the memory
idé,noun,idea,an image of an object that is formed in the mind or recalled by the memory
idé,noun,idea,"a conception in the mind of something to be done; a plan for doing something, an intention"
idé,noun,idea,a vague or fanciful notion; a feeling or hunch; an impression
innfall,noun,idea,a vague or fanciful notion; a feeling or hunch; an impression
tema,noun,idea,a musical theme or melodic subject
forestille seg,verb,imagine,(transitive) to form a mental image of something
forbedre,verb,improve,to make something better
bedre,verb,improve,to make something better
forbedre seg,verb,improve,to become better
informasjon,noun,information,communicable knowledge
interessere,verb,interest,to attract attention or concern
interessant,adj,interesting,arousing or holding the attention
øy,noun,island,area of land completely surrounded by water
øy,noun,island,entity surrounded by other entities that are very different from itself
jakke,noun,jacket,piece of clothing worn on the upper body outside a shirt or blouse
jakke,noun,jacket,piece of a person's suit
jobb,noun,job,economic role for which a person is paid
arbeid,noun,job,economic role for which a person is paid
sammenstille,verb,join,to combine more than one item into one; to put together
juice,noun,juice,liquid from a plant
jus,noun,juice,liquid from a plant
juice,noun,juice,beverage made of juice
jus,noun,juice,beverage made of juice
saft,noun,juice,liquid resembling juice
bare,adv,just,"only, simply, merely"
kun,adv,just,"only, simply, merely"
nettopp,adv,just,"recently, moments ago"
nettopp,adv,just,"exactly, precisely, perfectly"
kjøkken,noun,kitchen,room
land,noun,land,part of Earth that is not covered by oceans or other bodies of water
land,noun,land,country or region
språk,noun,language,body of words used as a form of communication
talemål,noun,language,body of words used as a form of communication
tunge,noun,language,body of words used as a form of communication
tungemål,noun,language,body of words used as a form of communication
taleevne,noun,language,the ability to communicate using words
språk,noun,language,nonverbal communication
språk,noun,language,vocabulary of a particular field
terminologi,noun,language,vocabulary of a particular field
språk,noun,language,particular words used
språk,noun,language,computer language — see also computer language
programmeringsspråk,noun,language,computer language — see also computer language
løves,verb,leave,To produce leaves
lauve,verb,leave,To produce leaves
lauvast,verb,leave,To produce leaves
lauve,verb,leave,To produce leaves
ben,noun,leg,lower limb from groin to ankle
bein,noun,leg,lower limb from groin to ankle
legg,noun,leg,portion of the lower appendage from knee to ankle
lekse,noun,lesson,learning task assigned to a student
lærepenge,noun,lesson,something that serves as a warning or encouragement
bokstav,noun,letter,a symbol in an alphabet
brev,noun,letter,written message
bibliotek,noun,library,"institution which holds books, etc."
lyge,verb,lie,tell an intentional untruth
ljuge,verb,lie,tell an intentional untruth
lyve,verb,lie,tell an intentional untruth
ligge,verb,lie,be in horizontal position
liv,noun,life,the state of being alive
liv,noun,life,the essence of the manifestation and the foundation of the being
liv,noun,life,the subjective and inner manifestation of the individual
liv,noun,life,a worthwhile existence
livstid,noun,life,life sentence
levetid,noun,life,duration
like,verb,like,to enjoy
synes om,verb,like,to enjoy
like,verb,like,to find attractive
synes om,verb,like,to find attractive
linje,noun,line,"path through two or more points, threadlike mark"
løve,noun,lion,big cat Panthera leo
løvinne,noun,lion,big cat Panthera leo
løve,noun,lion,heraldic charge
løve,noun,lion,famous person
liste,verb,list,to create or recite a list
lytte,verb,listen,to pay attention to a sound
lytte,verb,listen,to expect or wait for a sound
lystre,verb,listen,to accept advice or obey instruction
høre,verb,listen,to hear (something)
leve,verb,live,be alive
bo bu,verb,live,have permanent residence
lokal,adj,local,of a nearby location
se ut,verb,look,"to appear, to seem"
miste,verb,lose,cause (something) to cease to be in one's possession or capability
tape,verb,lose,(transitive) fail to win
elske,verb,love,have a strong affection for
elske,verb,love,be strongly inclined towards doing
like,verb,love,be strongly inclined towards doing
elske,verb,love,care about; will good for
elske med,verb,love,(euphemistic): to have sex with
lunsj,noun,lunch,meal around midday
maskin,noun,machine,mechanical or electrical device
tidsskrift,noun,magazine,periodical
magasin,noun,magazine,periodical
kjøpesenter,noun,mall,enclosed shopping centre
mann,noun,man,adult male human
menneske,noun,man,a human being
mann,noun,man,a human being
brikke,noun,man,piece in board games
sjakkbrikke,noun,man,piece in board games
kart,noun,map,visual representation of an area
marked,noun,market,spacious site for trading
markedsplass,noun,market,spacious site for trading
marked,noun,market,group of potential customers
markeds-,noun,market,used attributively
gift,adj,married,in a state of marriage; having a wife or a husband
pare,verb,match,make a successful pairing
kanskje,adv,maybe,indicating a lack of certainty
kan hende,adv,maybe,indicating a lack of certainty
må hende,adv,maybe,indicating a lack of certainty
kan hende,adv,maybe,as a pro-sentence
kanskje det,adv,maybe,as a pro-sentence
måltid,noun,meal,food that is prepared and eaten
mål,noun,meal,food that is prepared and eaten
innebære,verb,mean,"to convey, indicate"
mening,noun,meaning,symbolic value of something
betydning,noun,meaning,symbolic value of something
mening,noun,meaning,"significance of a thing, as ""the meaning of life"""
betydning,noun,meaning,definition or connotation of a word
tyding,noun,meaning,definition or connotation of a word
kjøtt,noun,meat,animal flesh used as food
kjøtt,noun,meat,type of meat
kjøtt,noun,meat,any sort of flesh
møte,verb,meet,to come face to face with by accident; to encounter
møte,verb,meet,to come face to face with someone by arrangement
møte,verb,meet,to gather for a formal or social discussion; to hold a meeting
møte,verb,meet,sport: to play a match
møte,noun,meeting,gathering for a purpose
medlem,noun,member,one who officially belongs to a group
lem,noun,member,"organ, limb"
lem,noun,member,penis
meny,noun,menu,details of the food to be served at a banquet
speisekart,noun,menu,details of the food to be served at a banquet
meny,noun,menu,list of dishes offered in a restaurant
meny,noun,menu,computing: list from which the user may select an operation to be performed
budskap,noun,message,"communication, concept or information conveyed"
melding,noun,message,"communication, concept or information conveyed"
måler,noun,meter,measuring instrument
takt,noun,meter,increment of music
midnatt,noun,midnight,12 o'clock at night exactly — see also twelve o'clock
mil,noun,mile,measure of length
melk,noun,milk,liquid
mjølk,noun,milk,liquid
minutt,noun,minute,unit of time
øyeblikk,noun,minute,short but unspecified period of time
minutt,noun,minute,unit of angular measure — see also minute of angle
protokoll,noun,minute,record of meeting
savne,verb,miss,to feel the absence of someone or something; to feel the want or need of
overse,verb,miss,"to fail to notice, to overlook"
feil,noun,mistake,an error
tabbe,noun,mistake,an error
feilgrep,noun,mistake,an error
modell,noun,model,person
mannekeng,noun,model,person
fotomodell,noun,model,person
øyeblikk,noun,moment,very brief period of time
tidspunkt,noun,moment,moment in time
øyeblikk,noun,moment,moment in time
penger,noun,money,means of exchange and measure of value
penger,noun,money,hard cash
måned,noun,month,period into which a year is divided
morgen,noun,morning,part of the day between dawn and midday
formiddag,noun,morning,part of the day between dawn and midday
morgen,noun,morning,the part of the day after midnight and before midday
mor,noun,mother,"female (human) who parents a child, gives birth to a baby, or is pregnant"
mamma,noun,mother,"female (human) who parents a child, gives birth to a baby, or is pregnant"
moder,noun,mother,"female (human) who parents a child, gives birth to a baby, or is pregnant"
mor,noun,mother,one’s female parent
mamma,noun,mother,one’s female parent
moder,noun,mother,one’s female parent
fjell,noun,mountain,large mass of earth and rock
berg,noun,mountain,large mass of earth and rock
mus,noun,mouse,rodent of the genus Mus
mus,noun,mouse,computing: input device
datamus,noun,mouse,computing: input device
munn,noun,mouth,the opening of a creature through which food is ingested
kjeft,noun,mouth,the opening of a creature through which food is ingested
munning,noun,mouth,the end of a river out of which water flows
flytte seg,verb,move,(intransitive) to change place or posture; to go
handle,verb,move,to act; to take action
flytte,verb,move,to change residence
flytte,verb,move,(transitive) to change the place of something
flytte,verb,move,to transfer from one space or position to another
røre,verb,move,to arouse the feelings or passions of
film,noun,movie,motion picture
museum,noun,museum,building or institution
musikk,noun,music,"sound, organized in time in a melodious way"
musikk,noun,music,any pleasing or interesting sounds
noter,noun,music,sheet music
navngi,verb,name,to publicly implicate
naturlig,adj,natural,of or relating to nature
naturlig,adj,natural,without additives
normal,adj,natural,as expected
naboskap,noun,neighborhood,area near one's home
aldri,adv,never,at no time
nyhet,noun,news,new information of interest
nytt,noun,news,new information of interest
tidende,noun,news,new information of interest
avis,noun,newspaper,publication
natt,noun,night,period between sunset and sunrise
kveld,noun,night,evening or night spent at a particular activity
aften,noun,night,evening or night spent at a particular activity
overnatting,noun,night,night spent away from home
nattesøvn,noun,night,quality of sleep obtained during a night
skumring,noun,night,nightfall
mørke,noun,night,darkness
nese,noun,nose,protuberance on the face
snute,noun,nose,"snout, nose of an animal"
mule,noun,nose,"snout, nose of an animal"
tryne,noun,nose,"snout, nose of an animal"
neseparti,noun,nose,tip of an object
mulelengde,noun,nose,length of a horse’s nose
nese,noun,nose,skill in recognising bouquet
ikke,adv,not,negates meaning of another word
ei,adv,not,negates meaning of another word
note,noun,note,memorandum
note,noun,note,musical sound
nå,adv,now,at the present time
antall,noun,number,abstract entity used to describe quantity
tall,noun,number,abstract entity used to describe quantity
tall,noun,number,numeral
tall,noun,number,mathematics: number
nummer,noun,number,used to show the rank of something in a list or sequence
sykepleier,noun,nurse,person trained to provide care for the sick
sykesøster,noun,nurse,person trained to provide care for the sick
søster,noun,nurse,person trained to provide care for the sick
pleier,noun,nurse,person trained to provide care for the sick
pleierske,noun,nurse,person trained to provide care for the sick
sykepleierske,noun,nurse,person trained to provide care for the sick
objekt,noun,object,thing
ting,noun,object,thing
gjenstand,noun,object,thing
objekt,noun,object,in grammar
gjenstand,noun,object,person or thing to which an emotion is directed
objekt,noun,object,object-oriented programming: instantiation of a class or structure
verdenshav,noun,ocean,one of the large bodies of water
osean,noun,ocean,one of the large bodies of water
kontor,noun,office,room(s) or building used for non-manual work
byrå,noun,office,room(s) or building used for non-manual work
gammel,adj,old,"of an object, concept, etc: having existed for a relatively long period of time"
gammal,adj,old,"of an object, concept, etc: having existed for a relatively long period of time"
gammel,adj,old,of a living being: having lived for relatively many years
gammal,adj,old,of a living being: having lived for relatively many years
gammel,adj,old,having existed or lived for the specified time
gammal,adj,old,having existed or lived for the specified time
på,adv,on,to an operating state
én gang,adv,once,one and only one time
en gang,adv,once,formerly
på et tidspunkt,adv,once,formerly
løk,noun,onion,Allium cepa
løk,noun,onion,bulb
mening,noun,opinion,thought a person has formed about a topic
synspunkt,noun,opinion,thought a person has formed about a topic
uttalelse,noun,opinion,EU: a judicial opinion by an Advocate General delivered to the European Court of Justice
befale,verb,order,to issue a command
beordre,verb,order,to issue a command
utafor,adv,outside,in or to the outside
utafor,adv,outside,outdoors
side,noun,page,one side of a leaf of a book
maling,noun,paint,substance
maleri,noun,painting,an illustration or artwork using paint
bilde,noun,painting,an illustration or artwork using paint
malerkunst,noun,painting,artistic application of paint
par,noun,pair,two similar or identical things
papir,noun,paper,sheet material
ark,noun,paper,sheet material
artikkel,noun,paper,written document shorter than a book
avsnitt,noun,paragraph,passage in text
forelder,noun,parent,person from whom one is descended
partner,noun,partner,someone who is associated with another in a common activity or interest
partner,noun,partner,a member of a business or law partnership
partner,noun,partner,"spouse, domestic, or romantic partner"
samboer,noun,partner,"spouse, domestic, or romantic partner"
partner,noun,partner,dancing partner
partner,noun,partner,either member of a pair in a card game or sports team (1.4)
fest,noun,party,social gathering
party,noun,party,social gathering
lag,noun,party,social gathering
pass,noun,passport,official document for foreign travel
fortid,noun,past,period of time that has already happened
preteritum,noun,past,(grammar) past tense
datid,noun,past,(grammar) past tense
betale,verb,pay,to give money in exchange for goods or services
lønne seg,verb,pay,to be profitable
hunnsvane,noun,pen,female swan
penn,noun,pen,writing tool
innhegning,noun,pen,enclosure (enclosed area) for animals
inngjerding,noun,pen,enclosure (enclosed area) for animals
kve,noun,pen,enclosure (enclosed area) for animals
blyant,noun,pencil,graphite writing-instrument
folk,noun,people,a body of human beings; a group of two or more persons
lyd,noun,people,a body of human beings; a group of two or more persons
mennesker,noun,people,a body of human beings; a group of two or more persons
folk,noun,people,a group of persons forming or belonging to a particular nation etc.
folk,noun,people,a group of persons regarded as being employees etc.
slekt,noun,people,"a person's ancestors, relatives or family"
folk,noun,people,the mass of community as distinguished from a special class
pepper,noun,pepper,spice
periode,noun,period,a length of time
periode,noun,period,history: period of time seen as coherent entity
æra,noun,period,history: period of time seen as coherent entity
punktum,noun,period,punctation mark “.”
periode,noun,period,length of time during which something repeats
person,noun,person,individual
menneske,noun,person,individual
person,noun,person,"specifically a human being — see also human, human being, man"
person,noun,person,the physical body seen as distinct from the mind
person,noun,person,any individual or formal organization with standing before the courts
person,noun,person,grammar: linguistic category
personrelatert,adj,personal,pertaining to human beings
menneskelig,adj,personal,pertaining to human beings
personlig,adj,personal,of or pertaining to a particular person
personlig,adj,personal,pertaining to the external or bodily appearance
