word,part_of_speech,english_word,sense
personlig,adj,personal,done in person
personlig,adj,personal,relating to an individual in an invidious and offensive manner
personlig,adj,personal,grammar: denoting person
fotografi,noun,photograph,picture
frase,noun,phrase,short written or spoken expression
frase,noun,phrase,grammar: group of two or more words that express an idea but do not form a complete sentence
frase,noun,phrase,music: small section of music in a larger piece
piano,noun,piano,a keyboard musical instrument
bilde,noun,picture,"representation of visible reality produced by drawing, etc"
bilde,noun,picture,photograph
fotografi,noun,picture,photograph
kino,noun,picture,cinema
stykke,noun,piece,part of a larger whole
svin,noun,pig,mammal of genus Sus
gris,noun,pig,mammal of genus Sus
storeter,noun,pig,someone who overeats or eats rapidly
purk,noun,pig,derogatory slang for police officer
snut,noun,pig,derogatory slang for police officer
rosa,noun,pink,pale red colour
nellik,noun,pink,flower
sted,noun,place,"location, position"
plass,noun,place,"open space, courtyard, market square"
sted,noun,place,any area of the earth
plass,noun,place,"area one occupies, particularly for sitting"
sted,noun,place,house or home
ståsted,noun,place,frame of mind
rolle,noun,place,"role or purpose, station"
plass,noun,place,the position of a contestant in a competition
plass,noun,place,the position as a member of a team
posisjon,noun,place,the position as a member of a team
posisjon,noun,place,numeric: the column counting a certain quantity
planlegge,verb,plan,to create a plan for
platan,noun,plane,deciduous tree
spill,noun,play,playful activity
skuespill,noun,play,literary composition intended to be represented
teaterstykke,noun,play,literary composition intended to be represented
skuespill,noun,play,theatrical performance
spiller,noun,player,one who plays any game or sport
skuespiller,noun,player,dramatic actor
spiller,noun,player,one who plays a musical instrument
musiker,noun,player,one who plays a musical instrument
spiller,noun,player,electronic device
spiss,noun,point,sharp tip
odde,noun,point,peninsula or promontory
politi,noun,police,local or general law enforcement agency
fattig,adj,poor,with few or no possessions or money
blakk,adj,poor,with few or no possessions or money
folkelig,adj,popular,of or pertaining to the common people
populær,adj,popular,liked by many people
positiv,adj,positive,grammar: describing the primary sense
potet,noun,potato,plant tuber eaten as starchy vegetable
jordeple,noun,potato,plant tuber eaten as starchy vegetable
pund,noun,pound,unit of mass (16 ounces avoirdupois)
pund,noun,pound,unit of currency
foretrekke,verb,prefer,to favor
forberede,verb,prepare,to make ready for a specific future purpose
nåtid,noun,present,current time
pris,noun,price,cost required to gain possession of something
antakeligvis,adv,probably,in all likelihood
trolig,adv,probably,in all likelihood
sannsynlig,adv,probably,in all likelihood
problem,noun,problem,difficulty
aber,noun,problem,difficulty
oppgave,noun,problem,schoolwork exercise
utfordring,noun,problem,puzzling circumstance
produkt,noun,product,commodity for sale
produkt,noun,product,amount created by a process
frambringelse,noun,product,amount created by a process
program,noun,program,set of structured activities
program,noun,program,performance of a show or other broadcast on radio or television
utsending,noun,program,performance of a show or other broadcast on radio or television
program,noun,program,software application
prosjekt,noun,project,planned endeavor
legge,verb,put,to place something somewhere
sette,verb,put,to place something somewhere
stille,verb,put,to place something somewhere
plassere,verb,put,to place something somewhere
ordlegge,verb,put,to express something in a certain manner
firedel,noun,quarter,one of four equal parts — see also one-fourth
fjerdedel,noun,quarter,one of four equal parts — see also one-fourth
kvartal,noun,quarter,period of three months
spørsmål,noun,question,"sentence, phrase or word"
stille,adj,quiet,with little sound
stille,adj,quiet,not talking
radio,noun,radio,technology
radio,noun,radio,receiver
radio,noun,radio,transmitter
lese,verb,read,to look at and interpret letters or other information
lese,verb,read,to speak aloud words or other information that is written
lese,verb,read,"to interpret or infer a meaning, significance, thought, intention, etc. from"
forstå,verb,read,to be able to hear (in a radio connection)
høre,verb,read,to be able to hear (in a radio connection)
oppfatte,verb,read,to be able to hear (in a radio connection)
studere,verb,read,to make a study of
leser,noun,reader,person who reads a publication
lesing,noun,reading,process of interpreting written language
lesning,noun,reading,event at which material is read aloud
årsak,noun,reason,that which causes: a cause
grunn,noun,reason,that which causes: a cause
grunn,noun,reason,motive for an action or determination
fornuft,noun,reason,(the capacity of the human mind for) rational thinking
huske,verb,remember,to recall from one's memory
minnes,verb,remember,to recall from one's memory
komme i hu,verb,remember,to recall from one's memory
gjenta,verb,repeat,do or say again
gjenfortelle,verb,repeat,do or say again
rapport,noun,report,information describing events
restaurant,noun,restaurant,an eating establishment in which diners are served food
resultat,noun,result,that which results
utfall,noun,result,that which results
følge,noun,result,that which results
resultat,noun,result,"fruit, beneficial or tangible effect"
utfall,noun,result,"fruit, beneficial or tangible effect"
retur,noun,return,act of returning
retur,noun,return,item that is returned
tilbakeleving,noun,return,item that is returned
resultat,noun,return,"formal report, set of tabulated statistics prepared for general information"
avkastning,noun,return,finance: gain or loss from an investment
selvangivelse,noun,return,finance: tax return
retur,noun,return,computing: carriage return character
returtast,noun,return,computing: carriage return character
vognretur,noun,return,computing: carriage return character
ris,noun,rice,plants
ris,noun,rice,seeds used as food
rik,adj,rich,having wealth
ri,verb,ride,"to transport oneself by sitting on and directing a horse, bicycle etc."
ride,verb,ride,"to transport oneself by sitting on and directing a horse, bicycle etc."
kjøre,verb,ride,to be transported in a vehicle as a passenger
rett,noun,right,legal or moral entitlement
riktighet,noun,right,legal or moral entitlement
høyre siden,noun,right,"right, not left, side"
høyre sida,noun,right,"right, not left, side"
flod,noun,river,large stream which drains a landmass
elv,noun,river,large stream which drains a landmass
å,noun,river,large stream which drains a landmass
vei,noun,road,a way for travel
rom,noun,room,space
plass,noun,room,space
rom,noun,room,division in a building
værelse,noun,room,division in a building
rutine,noun,routine,course of action to be followed regularly; a standard procedure
rutine,noun,routine,"set of normal procedures, often performed mechanically"
løpe,verb,run,to move quickly on two feet
springe,verb,run,to move quickly on two feet
gå,verb,run,"of a machine, to be operating normally"
kjøre,verb,run,"to execute or carry out a plan, procedure or program"
trist,adj,sad,feeling sorrow
lei seg,adj,sad,feeling sorrow
salat,noun,salad,food
salt,noun,salt,sodium chloride
bordsalt,noun,salt,sodium chloride
salt,noun,salt,compound of an acid and a base
sjøulk,noun,salt,sailor
sjøbjørn,noun,salt,sailor
sandwich,noun,sandwich,dish — see also open sandwich
smørbrød,noun,sandwich,dish — see also open sandwich
fortelle,verb,say,"to say, to tell"
si,verb,say,to pronounce
uttale,verb,say,to pronounce
resitere,verb,say,to recite
forrette,verb,say,to recite
si,verb,say,to indicate in a written form
opplyse,verb,say,to indicate in a written form
fortelle om,verb,say,to indicate in a written form
vise,verb,say,to indicate in a written form
si,verb,say,to have a common expression
det sies,verb,say,to have a common expression
stim,noun,school,a group of fish
flokk,noun,school,a group of fish
skole,noun,school,an institution dedicated to teaching and learning
fakultet,noun,school,a department/institute at a college or university
skole,noun,school,(collectively) the followers of a particular doctrine
vitenskap,noun,science,collective discipline of learning acquired through the scientific method
vitenskap,noun,science,particular discipline or branch of learning
kunskap,noun,science,knowledge gained through study or practice
forsker,noun,scientist,one whose activities make use of the scientific method
vitenskapsmann,noun,scientist,one whose activities make use of the scientific method
vitenskapskvinne,noun,scientist,one whose activities make use of the scientific method
sekund,noun,second,one-sixtieth of a minute; SI unit of time
sekund,noun,second,unit of angular measure
buesekund,noun,second,unit of angular measure
sekund,noun,second,"short, indeterminate amount of time"
øyeblikk,noun,second,"short, indeterminate amount of time"
sekund,noun,second,music: interval between two adjacent notes
seksjon,noun,section,"part, piece or subdivision of anything"
se,verb,see,perceive with the eyes
skjønne,verb,see,understand
forstå,verb,see,understand
domsslutning,noun,sentence,"(dated) decision or judgement of a court — see also judgment, verdict"
dom,noun,sentence,"(dated) decision or judgement of a court — see also judgment, verdict"
dom,noun,sentence,judicial order for punishment
straff,noun,sentence,punishment imposed on a person convicted of a crime — see also punishment
setning,noun,sentence,grammatically complete series of words consisting of a subject and predicate
skjorte,noun,shirt,article of clothing
sko,noun,shoe,protective covering for the foot
shopping,noun,shopping,activity of buying
innkjøp,noun,shopping,activity of buying
handling,noun,shopping,activity of buying
varer,noun,shopping,things bought
matvarer,noun,shopping,things bought
kort,adj,short,having a small distance between ends or edges
burde,verb,should,expressing opinion
skulle,verb,should,expressing opinion
show,noun,show,entertainment
show,noun,show,broadcast program(me)
program,noun,show,broadcast program(me)
byge,noun,shower,brief fall of rain
regnbyge,noun,shower,brief fall of rain
dusj,noun,shower,device for bathing
dusj,noun,shower,instance of using of this device
regn,noun,shower,quantity of something that has characteristics of a rain shower
viser,noun,shower,one who shows
lignende,adj,similar,"having traits or characteristics in common; alike, comparable"
liknende,adj,similar,"having traits or characteristics in common; alike, comparable"
synge,verb,sing,to produce harmonious sounds with one’s voice
sanger,noun,singer,person who sings (male or generic term)
sangerinne,noun,singer,female person who sings
søster,noun,sister,woman or girl having the same parents
storesøster,noun,sister,woman or girl having the same parents
lillesøster,noun,sister,woman or girl having the same parents
ligge,verb,sit,of an object: occupy a given position permanently
skjørt,noun,skirt,article of clothing
skjørt,noun,skirt,part of dress that hangs below waist
skjørt,noun,skirt,slang: woman
skjørt,noun,skirt,women collectively
sove,verb,sleep,to rest in state of reduced consciousness
langsom,adj,slow,not quick in motion
liten,adj,small,"minuscule or lowercase, referring to written letters"
smart,adj,smart,"exhibiting intellectual knowledge, such as that found in books"
klok,adj,smart,"exhibiting intellectual knowledge, such as that found in books"
flott,adj,smart,good-looking
slange,noun,snake,legless reptile
orm,noun,snake,legless reptile
slange,noun,snake,treacherous person
snø,verb,snow,have snow fall from the atmosphere
sønn,noun,son,a male person in relation to his parents
sang,noun,song,music with words
lyde,verb,sound,to produce a sound
suppe,noun,soup,dish
verdensrom,noun,space,area beyond atmosphere of planets
plass,noun,space,bounded or specific physical extent
snakke,verb,speak,to communicate with one's voice using words
preke,verb,speak,to communicate with one's voice using words
tale,verb,speak,to communicate with one's voice using words
konversere,verb,speak,to have a conversation
snakke,verb,speak,to have a conversation
prate,verb,speak,to have a conversation
kommunisere,verb,speak,to communicate or converse by some means other than orally
tale,verb,speak,to deliver a speech
snakke,verb,speak,to be able to communicate in a language
si,verb,speak,to utter
spesiell,adj,special,distinguished by a unique or unusual quality
spesial,adj,special,distinguished by a unique or unusual quality
stave,verb,spell,to write or say the letters that form a word
stavemåte,noun,spelling,manner of spelling of words; correct spelling
idrett,noun,sport,any athletic activity that uses physical skills
sport,noun,sport,any athletic activity that uses physical skills
vår,noun,spring,season between winter and summer in temperate climates
kilde,noun,spring,water springing from the ground
fjær,noun,spring,device made of flexible material
motstå,verb,stand,to undergo; withstand; hold up
stjerne,noun,star,"a celestial body appearing as a point of light on the clear night sky, whose position is relatively fixed with respect to each other"
stjerne,noun,star,celebrity
stjerne,noun,star,quality rating symbol
stasjon,noun,station,place where a vehicle may stop
ennå,adv,still,"up to a time, as in the preceding time"
fremdeles,adv,still,"up to a time, as in the preceding time"
fortsatt,adv,still,"up to a time, as in the preceding time"
holdeplass,noun,stop,place to get on and off mass transport
stoppested,noun,stop,place to get on and off mass transport
lager,noun,store,place where items may be kept
lager,noun,store,supply held in storage
forråd,noun,store,supply held in storage
historie,noun,story,account of events
gate,noun,street,paved part of road in a village or a town
sterk,adj,strong,capable of producing great physical force
sterk,adj,strong,fast moving water
sterk,adj,strong,highly stimulating to the senses
sterk,adj,strong,having an offensive or intense odor or flavor
sterk,adj,strong,having a high concentration of an essential or active ingredient
sterk,adj,strong,having a high alcoholic content
sterk,adj,strong,grammar: irregular
student,noun,student,person who studies a subject
student,noun,student,person enrolled at a university — see also university student
studere,verb,study,to acquire knowledge
subjekt,noun,subject,in grammar
emne,noun,subject,main topic
tema,noun,subject,main topic
fag,noun,subject,particular area of study
undersått,noun,subject,citizen in a monarchy
undersått,noun,subject,"person ruled over by another, especially a monarch or state authority"
suksess,noun,success,achievement of one's aim or goal
suksess,noun,success,person who achieves his or her goals
sukker,noun,sugar,sucrose from sugar cane or sugar beet used to sweeten food and drink
sukker,noun,sugar,any of a series of carbohydrates used by organisms to store energy
sukker,noun,sugar,"generic term for sucrose, glucose, fructose, etc"
kjære,noun,sugar,term of endearment
sommer,noun,summer,hottest season
sol,noun,sun,"a star, especially when seen as the centre of any single solar system"
supermarked,noun,supermarket,store
sikker,adj,sure,certain in one's knowledge or belief
genser,noun,sweater,similar garment worn for warmth
svømme,verb,swim,move through water
svømming,noun,swimming,human activity of moving oneself through water
bord,noun,table,item of furniture
tabell,noun,table,grid of data in rows and columns
tabell,noun,table,collection of arithmetic calculations
ta,verb,take,to get into one's hands or control
gripe,verb,take,to get into one's hands or control
ta,verb,take,to get into one's possession
ta,verb,take,to receive or accept
ta imot,verb,take,to receive or accept
ta,verb,take,to grab and move to oneself
ta,verb,take,to gain a position by force
ta,verb,take,to have sex with
bringe,verb,take,to carry
ta,verb,take,to choose
tåle,verb,take,to endure
ta,verb,take,to endure
ta,verb,take,to ingest medicine
snakke,verb,talk,to communicate by speech
preke,verb,talk,to communicate by speech
høy,adj,tall,of a person
te,noun,tea,dried leaves of tea plant
te,noun,tea,drink made from leaves of tea plant
te,noun,tea,cup of this drink
te,noun,tea,drink made from other plants
te,noun,tea,cup of drink made from other plants
te,noun,tea,light afternoon meal
formiddagste,noun,tea,light afternoon meal
ettermiddagste,noun,tea,light afternoon meal
lærer,noun,teacher,person who teaches
skolelærer,noun,teacher,person who teaches
lærerinne,noun,teacher,woman who teaches
frøken,noun,teacher,woman who teaches
spann,noun,team,set of draught animals
lag,noun,team,group of people
team,noun,team,group of people
tenåring,noun,teenager,person aged between thirteen and nineteen
ringe,verb,telephone,to call someone
fjernsyn,noun,television,medium
TV,noun,television,medium
televisjon,noun,television,medium
fjernsyn,noun,television,device for receiving television signals
TV,noun,television,device for receiving television signals
fjernsynsapparat,noun,television,device for receiving television signals
fjernsyn,noun,television,program broadcasting
TV,noun,television,program broadcasting
fjernsyn,noun,television,program broadcasting
TV,noun,television,program broadcasting
fortelle,verb,tell,to pass information
si,verb,tell,to pass information
tennis,noun,tennis,sport played by two or four players with strung racquets
tekst,noun,text,a written passage
teater,noun,theater,place or building
på den annen side,adv,then,at the same time; on the other hand
ting,noun,thing,"that which is considered to exist as a separate entity, object, quality or concept"
dings,noun,thing,"that which is considered to exist as a separate entity, object, quality or concept"
greie,noun,thing,"that which is considered to exist as a separate entity, object, quality or concept"
tenke,verb,think,"to ponder, to go over in one's head"
fundere,verb,think,"to ponder, to go over in one's head"
tenke,verb,think,communicate to oneself in one’s mind
resonnere,verb,think,communicate to oneself in one’s mind
komme på,verb,think,to conceive of something or someone
synes,verb,think,be of the opinion that
mene,verb,think,be of the opinion that
tro,verb,think,"guess, reckon"
anta,verb,think,"guess, reckon"
synes,verb,think,"consider, judge, regard something as"
mene,verb,think,"consider, judge, regard something as"
tørst,adj,thirsty,needing to drink
billett,noun,ticket,admission to entertainment
billett,noun,ticket,pass for transportation
bot,noun,ticket,traffic citation
førerkort,noun,ticket,permit to operate machine
tid,noun,time,inevitable passing of events
tid,noun,time,quantity of availability in time
tempo,noun,time,quantity of availability in time
klokkeslett,noun,time,"time of day, as indicated by a clock, etc"
tidspunkt,noun,time,"time of day, as indicated by a clock, etc"
tid,noun,time,measurement under some system of the time of day or moment in time
tid,noun,time,instance or occurrence
gang,noun,time,instance or occurrence
soningstid,noun,time,slang: serving of a prison sentence
tid inne,noun,time,slang: serving of a prison sentence
trett,adj,tired,in need of rest or sleep
trøtt,adj,tired,in need of rest or sleep
tittel,noun,title,prefix or suffix added to a name
tittel,noun,title,"name of a book, etc"
tittel,noun,title,subject of a writing
i dag,noun,today,today (noun)
sammen,adv,together,"at the same time, in the same place"
sammen,adv,together,into one place
pynting,noun,toilet,personal grooming
omkledningsrom,noun,toilet,dressing room
toalett,noun,toilet,"room used for urination and defecation — see also bathroom, men's room, ladies' room, outhouse, portable toilet, latrine, shitter"
do,noun,toilet,"room used for urination and defecation — see also bathroom, men's room, ladies' room, outhouse, portable toilet, latrine, shitter"
WC,noun,toilet,"room used for urination and defecation — see also bathroom, men's room, ladies' room, outhouse, portable toilet, latrine, shitter"
klosett,noun,toilet,"room used for urination and defecation — see also bathroom, men's room, ladies' room, outhouse, portable toilet, latrine, shitter"
toalett,noun,toilet,"fixture used for urination and defecation — see also flush toilet, squat toilet, chemical toilet, urinal, latrine"
vannklosett,noun,toilet,"fixture used for urination and defecation — see also flush toilet, squat toilet, chemical toilet, urinal, latrine"
vassklosett,noun,toilet,"fixture used for urination and defecation — see also flush toilet, squat toilet, chemical toilet, urinal, latrine"
dass,noun,toilet,place resembling a filthy toilet
tomatplante,noun,tomato,tomato plant
tomat,noun,tomato,tomato plant
tomat,noun,tomato,fruit
også,adv,too,likewise
òg,adv,too,likewise
med,adv,too,likewise
for,adv,too,more than enough; as too much
altfor,adv,too,more than enough; as too much
tann,noun,tooth,anatomy: tooth
tann,noun,tooth,saw tooth
emne,noun,topic,subject; theme
tema,noun,topic,subject; theme
turist,noun,tourist,someone who travels for pleasure
by,noun,town,settlement
trafikk,noun,traffic,pedestrians or vehicles on roads or on the air
ferdsel,noun,traffic,pedestrians or vehicles on roads or on the air
tog,noun,train,line of connected cars or carriages
reise,noun,travel,act of traveling
tre,noun,tree,large woody plant
lastebil,noun,truck,"heavier motor vehicle designed to carry goods — see also semi-trailer truck, pickup truck"
sving,noun,turn,change of direction or orientation
vending,noun,turn,change of direction or orientation
vridning,noun,turn,change of direction or orientation
omdreining,noun,turn,movement about an axis ending up with the same orientation
etter tur,noun,turn,chance to use (something) shared in sequence with others
tur,noun,turn,chance to use (something) shared in sequence with others
tur,noun,turn,one's chance to make a move in a game
to ganger,adv,twice,two times
type,noun,type,grouping based on shared characteristics
paraply,noun,umbrella,cloth-covered frame used for protection against rain or sun
onkel,noun,uncle,brother (or brother-in-law) of someone’s parent
farbror,noun,uncle,brother (or brother-in-law) of someone’s parent
morbror,noun,uncle,brother (or brother-in-law) of someone’s parent
onkel,noun,uncle,UK informal: pawnbroker — see also pawnbroker
pantelåner,noun,uncle,UK informal: pawnbroker — see also pawnbroker
filleonkel,noun,uncle,close male friend of the parents
farbror,noun,uncle,form of address to a man by young people or children in some countries
forstå,verb,understand,to grasp the meaning of
skjønne,verb,understand,to grasp the meaning of
kunne,verb,understand,to grasp the meaning of
forstå,verb,understand,to believe one grasps the meaning of
skjønne,verb,understand,to believe one grasps the meaning of
forstå,verb,understand,to believe
fatte,verb,understand,to believe
universitet,noun,university,institution of higher education
bruke,verb,use,"employ, apply"
tjenlig,adj,useful,having a practical or beneficial use
ferie,noun,vacation,period of leisure time
grønnsak,noun,vegetable,a plant raised for some edible part of it
grønnsak,noun,vegetable,edible part of such a plant
grønnsak,noun,vegetable,a person whose brain has been damaged
veldig,adv,very,to a high degree
meget,adv,very,to a high degree
video,noun,video,"television show, movie"
video,noun,video,film clip
video,noun,video,motion picture stored on VHS
besøk,noun,visit,single act of visiting
visitt,noun,visit,single act of visiting
anløp,noun,visit,single act of visiting
besøkende,noun,visitor,guest
gjest,noun,visitor,guest
vente,verb,wait,delay until some event
bie,verb,wait,delay until some event
servitør,noun,waiter,a server in a restaurant or similar
kelner,noun,waiter,a server in a restaurant or similar
ventende,noun,waiter,someone who waits
våkne,verb,wake,to stop sleeping
gåtur,noun,walk,trip made by walking
spasertur,noun,walk,trip made by walking
vegg,noun,wall,defensive rampart
voll,noun,wall,defensive rampart
mur,noun,wall,structure built for defense surrounding an area
vegg,noun,wall,substantial structure acting as side or division in a building
forhindring,noun,wall,impediment to free movement
skillevegg,noun,wall,"anatomy, zoology, botany: divisive or containing structure"
varm,adj,warm,having a temperature slightly higher than usual
klokke,noun,watch,portable or wearable timepiece
ur,noun,watch,portable or wearable timepiece
armbåndsur,noun,watch,portable or wearable timepiece
vakt,noun,watch,particular time period
vakt,noun,watch,person or group of people who guard
vakt,noun,watch,period of time on duty
vann,noun,water,inorganic compound H₂O
vei,noun,way,"road, direction, path"
bære,verb,wear,to have on (clothes or accessories)
ha på seg,verb,wear,to have on (clothes or accessories)
vær,noun,weather,state of the atmosphere
nettside,noun,website,a collection of pages on the World Wide Web
hjemmeside,noun,website,a collection of pages on the World Wide Web
heimeside,noun,website,a collection of pages on the World Wide Web
uke,noun,week,period of seven days
helg,noun,weekend,break in the working week
kjærkommen,adj,welcome,whose arrival is a cause of joy
velkommen,adj,welcome,whose arrival is a cause of joy
hvor,adv,where,at what place; to what place; from what place
hvor,adv,where,at or in which place
hvor,adv,where,the place in which
der,adv,where,the place in which
hvit,noun,white,color
kvit,noun,white,color
hvit,noun,white,person of European descent
hvorfor,adv,why,for what reason
hustru,noun,wife,female partner in a marriage
kone,noun,wife,female partner in a marriage
frue,noun,wife,female partner in a marriage
testamentere,verb,will,to bequeath
vil,verb,will,indicating future action
kommer til å,verb,will,indicating future action
